{
 "technology_id": "CAND-18",
 "external_name": "External NousResearch Hermes Agent",
 "internal_short_name": "CAND-18_SLOT",
 "capability_slot": "external runtime donor",
 "source_repository": "SOURCE_REPOSITORY_RECHECK_REQUIRED",
 "license": "UNKNOWN",
 "observed_version": "exact external repo/tag/commit required",
 "selected_baseline": "PIPD-LS-SP_藍圖@2026-10-08_r2",
 "immutable_pin": "LATEST",
 "disposition": "QUARANTINE",
 "adoption_owner": "HGK",
 "integration_owner": "HGK",
 "translation_method": "external donor only; distinct from internal HGK binding",
 "adapter_contract": "TechnologyAdmission@1+SourceFreezeManifestRef",
 "known_limitations": [
  "design disposition not active installation",
  "upstream pin and rights to be validated"
 ],
 "security_requirements": [
  "no second SSOT",
  "permission narrowing",
  "secret-free packaging"
 ],
 "verification_suite": "donor identity isolation + no auto-upgrade",
 "install_plan": "HGK/receiver governed shadow-only after pin/license verification; NOT_EXECUTED",
 "enablement_plan": "ACK+permission+negative suite+rollback before canary; NOT_EXECUTED",
 "rollback_plan": "disable adapter + restore last verified native path and subject/hash evidence",
 "fallback": "current HGK canonical Hermes binding",
 "reselection_trigger": "identity/provenance conflation",
 "current_design_state": "QUARANTINE_EXTERNAL_DONOR",
 "current_runtime_state": "NOT_EXECUTED",
 "design_selection_state": "DESIGN_DISPOSITION_TERMINALIZED",
 "adapter_materialization_state": "DESIGN_CONTRACT_SPECIFIED_NOT_INSTALLED",
 "runtime_admission_state": "BLOCKED_EXTERNAL_PIN_LICENSE_PENDING",
 "upstream_disposition": "QUARANTINE",
 "adapter_ref": "pack://PIPD-PKG-00/technology/CAND-18/adapter@r2",
 "output_ref": "CAND-18_TechnologySelectionRecord@2",
 "schema_ref": "urn:pipd:pkg00:r2:tech:CAND-18",
 "fixture_ref": "fixtures/CAND-18/mutation-unpinned.json",
 "oracle_ref": "OR-ANTI-CAND-18",
 "acceptance_gate_ref": "G-TECH-SOURCE-PIN+G-TECH-NEGATIVE+G-TECH-ROLLBACK",
 "rollback_target": "prior approved native/provider-off lane",
 "capability_need": "external runtime donor",
 "candidate": "External NousResearch Hermes Agent",
 "pin_license_currentness": {
  "pin": "PIN_REVALIDATION_REQUIRED",
  "license": "LICENSE_NOT_INDEPENDENTLY_PIN_VERIFIED",
  "currentness": "QUARANTINE_EXTERNAL_DONOR",
  "independently_verified": false
 },
 "fallback_exit": "current HGK canonical Hermes binding",
 "subject_id": "subset-tech-f15c0625fd3d5cd6d03439f12e66fc6c",
 "version": "exact external repo/tag/commit required",
 "schema_version": "TechnologyAdmission@2",
 "content_hash": "26c59e41aff6de65d5f9b9fc637c180f34bd31104cb5a8a5358958049c0e09a1"
}