{
 "technology_id": "CAND-10",
 "external_name": "Superpowers",
 "internal_short_name": "CAND-10_SLOT",
 "capability_slot": "TDD/planning/review skill donor",
 "source_repository": "SOURCE_REPOSITORY_RECHECK_REQUIRED",
 "license": "UNKNOWN",
 "observed_version": "release/commit pin; latest support finding v6.4.2 2026-09-25",
 "selected_baseline": "PIPD-LS-SP_藍圖@2026-10-08_r2",
 "immutable_pin": "LATEST",
 "disposition": "ADOPT_WITH_TRANSLATION",
 "adoption_owner": "PIPD/HGK",
 "integration_owner": "PIPD/HGK",
 "translation_method": "optional method/skill provider",
 "adapter_contract": "TechnologyAdmission@1+SourceFreezeManifestRef",
 "known_limitations": [
  "design disposition not active installation",
  "upstream pin and rights to be validated"
 ],
 "security_requirements": [
  "no second SSOT",
  "permission narrowing",
  "secret-free packaging"
 ],
 "verification_suite": "plan/TDD/verification parity tests",
 "install_plan": "HGK/receiver governed shadow-only after pin/license verification; NOT_EXECUTED",
 "enablement_plan": "ACK+permission+negative suite+rollback before canary; NOT_EXECUTED",
 "rollback_plan": "disable adapter + restore last verified native path and subject/hash evidence",
 "fallback": "PIPD native methods",
 "reselection_trigger": "method semantic/permission drift",
 "current_design_state": "RECHECK_RELEASE",
 "current_runtime_state": "NOT_EXECUTED",
 "design_selection_state": "DESIGN_BASELINE_SELECTED",
 "adapter_materialization_state": "DESIGN_CONTRACT_SPECIFIED_NOT_INSTALLED",
 "runtime_admission_state": "BLOCKED_EXTERNAL_PIN_LICENSE_PENDING",
 "upstream_disposition": "ADOPT_WITH_TRANSLATION",
 "adapter_ref": "pack://PIPD-PKG-00/technology/CAND-10/adapter@r2",
 "output_ref": "CAND-10_TechnologySelectionRecord@2",
 "schema_ref": "urn:pipd:pkg00:r2:tech:CAND-10",
 "fixture_ref": "fixtures/CAND-10/mutation-unpinned.json",
 "oracle_ref": "OR-ANTI-CAND-10",
 "acceptance_gate_ref": "G-TECH-SOURCE-PIN+G-TECH-NEGATIVE+G-TECH-ROLLBACK",
 "rollback_target": "prior approved native/provider-off lane",
 "capability_need": "TDD/planning/review skill donor",
 "candidate": "Superpowers",
 "pin_license_currentness": {
  "pin": {
   "value": "LATEST",
   "repository": "SOURCE_REPOSITORY_RECHECK_REQUIRED",
   "reason_code": "MUT_TECH_PIN",
   "reason": "mutation: mutable pin contradicts an active claim"
  },
  "license": {
   "value": "UNKNOWN",
   "known": false,
   "blocks_activation": true,
   "disposition": "UNKNOWN_LICENCE_BLOCKS_ACTIVATION"
  },
  "currentness": "RECHECK_RELEASE",
  "ttl_security_note": "no runtime freshness window is claimed; the source pin is UNAVAILABLE and any activation requires a fresh receiver-side revalidation and a bounded TTL before canary. Security: no-second-SSOT, permission narrowing, secret-free packaging.",
  "fallback": "PIPD native methods",
  "exit_criterion": "method semantic/permission drift",
  "permission_scope": "READ+PROPOSE only; no writeback; HGK/receiver governed, shadow-only",
  "provider_off_behaviour": "PIPD native methods",
  "disposition": "ADOPT",
  "design_disposition": "ADOPT_WITH_TRANSLATION",
  "pin_verified": false,
  "licence_known": false,
  "reported_active": true,
  "activation_reason": "ADOPT but the source pin is UNAVAILABLE (unverified)",
  "independently_verified": false
 },
 "fallback_exit": "PIPD native methods",
 "subject_id": "subset-tech-4c00bd0aa66db6b5e36c400ee3beddaf",
 "version": "release/commit pin; latest support finding v6.4.2 2026-09-25",
 "schema_version": "TechnologyAdmission@2",
 "content_hash": "362bff4fc694c7ad695290b13e0351a48e49ff04309ef83910300bdbc0b710a6"
}